arabic_ctx,arabic_res,chinese_ctx,chinese_res,english_ctx,english_res,french_ctx,french_res,german_ctx,german_res,hindi_ctx,hindi_res,japanese_ctx,japanese_res,korean_ctx,korean_res,russian_ctx,russian_res,spanish_ctx,spanish_res,ratings
"محظوظ لك! لا أستطيع شراء أي شيء آخر . إني مفلس تماما.
حصلت على استبدال ملابس الحفلة الخاصة بي ، لقد قمت بالتخلص منها الأسبوع الماضي.",نعم ، ربما كنت على حق. ماذا عن هذا الزي؟,"你真幸运！我不能再买别的东西了。我身无分文。
我换了一套派对服装，上个星期我把它搞砸了。",是啊，也许你是对的。这套衣服怎么样？,"Lucky you ! I can't buy anything else . I'm flat broke .
I got a replace my party outfit , I trashed it last week .","yeah , maybe you ' re right . How about this outfit ?","Vous avez de la chance ! Je ne peux rien acheter d’autre. Je suis fauché.
J’ai eu un remplacement de ma tenue de fête, je l’ai saccagé la semaine dernière.","Oui, peut-être que vous avez raison. Que diriez-vous de cette tenue ?","Glück gehabt! Ich kann nichts anderes kaufen. Ich bin pleite.
Ich habe ein Ersatz für mein Party-Outfit bekommen, ich habe es letzte Woche vernichtet.","Ja, vielleicht hast du recht. Wie wäre es mit diesem Outfit?","भाग्यशाली आप! मैं कुछ और नहीं खरीद सकता। मैं कंगाल हो गया हूँ।
मुझे अपनी पार्टी की पोशाक बदल दी गई , मैंने पिछले सप्ताह इसे रद्द कर दिया .","हाँ, शायद आप सही हैं। इस पोशाक के बारे में क्या?","ラッキー !他に何も買えません.私は無一文です。
私は私のパーティーの衣装を交換しました、私は先週それをゴミ箱に捨てました。",ええ、多分あなたは正しいです.この衣装はどうですか?,"운이 좋다! 나는 다른 것을 살 수 없다 . 나는 완전히 파산이다.
파티 복장을 교체했는데 지난주에 버렸습니다.","예, 아마도 당신이 옳을 것입니다. 이 복장은 어때?","Вам повезло! Я не могу купить ничего другого. Я на мели.
Я получил замену моему партийному наряду, я разбил его на прошлой неделе.","Да, может быть, вы правы. Как насчет этого наряда?","¡Suerte! No puedo comprar nada más. No tengo un centavo.
Conseguí un reemplazo de mi atuendo de fiesta, lo destrocé la semana pasada.","Sí, tal vez tengas razón. ¿Qué tal este atuendo?",3.5
"إنه معرض لليشم الصيني. يقام كل عام . مجموعة لطيفة من اليشم معروضة وتباع.
يبدو رائعا! هل يمكنك التوقف في مكان ما هنا لمدة دقيقة؟ سأحصل على بعض الهدايا التذكارية لأصدقائي.",نحن نتشارك نفس الرغبة . هل شاهدت عرض منتجاتنا في قاعة المعرض في الطابق السفلي؟,"这是一场中国玉器展览。它每年举行一次。一批精美的玉器正在展出和出售。
听起来很棒！你能在这里的某个地方停一下吗？我要给我的朋友们买些纪念品。",我们有着相同的愿望。您看过楼下展厅里展示的我们的产品了吗？,"It is an exhibition of Chinese jades . It is held each year . A nice collection jades of are on display and sold .
Sounds great ! Can you stop somewhere here for a minute ? I will get some souvenirs for my friends .",We share the same desire . Have you seen the display of our products in the exhibition hall downstairs ?,"Il s’agit d’une exposition de jades chinois. Il a lieu chaque année. Une belle collection de jades de sont exposés et vendus.
Ça sonne bien ! Pouvez-vous vous arrêter quelque part ici pendant une minute ? Je vais chercher des souvenirs pour mes amis.",Nous partageons le même désir. Avez-vous vu l’exposition de nos produits dans le hall d’exposition en bas ?,"Es ist eine Ausstellung chinesischer Jade. Es findet jedes Jahr statt. Eine schöne Sammlung von Jaden sind ausgestellt und verkauft.
Hört sich gut an! Können Sie hier irgendwo für eine Minute anhalten? Ich werde ein paar Souvenirs für meine Freunde besorgen.",Wir teilen den gleichen Wunsch. Haben Sie die Ausstellung unserer Produkte in der Ausstellungshalle im Erdgeschoss gesehen?,"यह चीनी जेडों की प्रदर्शनी है। यह हर साल आयोजित किया जाता है। एक अच्छा संग्रह जेड प्रदर्शन पर हैं और बेचे जाते हैं।
बहुत अच्छा लगता है! क्या आप यहां एक मिनट के लिए रुक सकते हैं? मुझे अपने दोस्तों के लिए कुछ स्मृति चिन्ह मिलेंगे।",हम एक ही इच्छा साझा करते हैं। क्या आपने नीचे प्रदर्शनी हॉल में हमारे उत्पादों का प्रदर्शन देखा है?,"中国の翡翠の展示です。毎年開催されています。素敵なコレクションの翡翠が展示され、販売されています。
いいですね！ちょっとここのどこかに立ち寄ってくれませんか?友達にお土産をもらいます。",私たちは同じ欲求を共有しています 。階下の展示ホールで当社製品の展示を見たことがありますか?,"중국 옥 전시회입니다. 매년 개최됩니다. 멋진 컬렉션 옥이 전시되어 판매됩니다.
멋지네요! 여기 어딘가에서 잠깐 멈출 수 있습니까? 나는 친구들을위한 기념품을 얻을 것이다.",우리는 같은 욕망을 공유합니다. 아래층 전시장에서 우리 제품의 디스플레이를 보셨습니까?,"Это выставка китайского нефрита. Он проводится каждый год. Хорошая коллекция нефритов выставлена на обозрение и продается.
Звучит здорово! Можете ли вы остановиться где-нибудь здесь на минуту? Я получу несколько сувениров для моих друзей.",Мы разделяем одно и то же желание. Вы видели выставку нашей продукции в выставочном зале внизу?,"Se trata de una exposición de jades chinos. Se celebra cada año. Una bonita colección de jades de están en exhibición y se venden.
¡Excelente! ¿Puedes parar en algún lugar aquí por un minuto? Conseguiré algunos recuerdos para mis amigos.",Compartimos el mismo deseo. ¿Ha visto la exhibición de nuestros productos en la sala de exposiciones de abajo?,2.9
"هل سبق لك أن حاولت التسوق عبر الإنترنت؟
لا ، أبدا . أفضل أن أرى وألمس ما أشتريه قبل أن أدفع ثمنه ، خاصة بالنسبة للملابس والأحذية.",لماذا لا تذهب للتسوق عبر الإنترنت؟,"你试过网上购物吗？
不，永远不会。我更喜欢在付钱之前亲眼看到和触摸我要买的东西，特别是衣服和鞋子。",你为什么不去网上购物呢？,"Have you ever tried shopping online ?
No , never . I prefer to actually see and touch what I'm buying before I pay for it , especially for clothes and shoes .",Why don't you go shopping online ?,"Avez-vous déjà essayé de magasiner en ligne ?
Non, jamais. Je préfère réellement voir et toucher ce que j’achète avant de le payer, en particulier pour les vêtements et les chaussures.",Pourquoi ne pas faire vos achats en ligne ?,"Haben Sie schon einmal versucht, online einzukaufen?
Nein, niemals. Ich ziehe es vor, das, was ich kaufe, tatsächlich zu sehen und zu berühren, bevor ich dafür bezahle, besonders für Kleidung und Schuhe.",Warum gehen Sie nicht online einkaufen?,"क्या आपने कभी ऑनलाइन खरीदारी करने की कोशिश की है?
नहीं, कभी नहीं। मैं वास्तव में देखना और छूना पसंद करता हूं कि मैं इसके लिए भुगतान करने से पहले क्या खरीद रहा हूं, खासकर कपड़े और जूते के लिए।",आप ऑनलाइन खरीदारी क्यों नहीं करते?,"オンラインショッピングを試したことがありますか?
いいえ、決して.私はそれを支払う前に、特に服や靴のために、私が買っているものを実際に見て触れることを好みます。",オンラインショッピングに行ってみませんか?,"온라인 쇼핑을 해본 적이 있습니까?
아니, 절대 . 나는 특히 옷과 신발을 지불하기 전에 내가 사는 것을 실제로보고 만지는 것을 선호합니다.",온라인 쇼핑을하지 않으시겠습니까?,"Вы когда-нибудь пробовали делать покупки в Интернете?
Нет, никогда. Я предпочитаю на самом деле видеть и трогать то, что я покупаю, прежде чем платить за это, особенно за одежду и обувь.",Почему бы вам не пойти за покупками в Интернете?,"¿Alguna vez has intentado comprar en línea?
No, nunca. Prefiero ver y tocar lo que estoy comprando antes de pagarlo, especialmente para la ropa y los zapatos.",¿Por qué no vas de compras online?,3.3
"كم هو لطيف منه . سأكون سعيدا للذهاب . ولكن ما الوقت سيكون مناسبا؟
إذا كنت يمكن أن تكون جاهزا بحلول الساعة 6:30 ، سأكون في الفندق لاصطحابك.",هذا جيد. سأكون في انتظارك .,"他真是个好人。我很乐意去。但是什么时候方便呢？
如果你能在6：30之前准备好，我会在旅馆接你。",那很好。我会等你的。,"How nice of him . I'll be delighted to go . But what time would be convenient ?
If you could be ready by , say 6:30 o'clock , I'll be at the hotel to pick you up .",That's fine . I'll be waiting for you .,"Comme c’est gentil de sa part. Je serai ravi d’y aller. Mais quelle heure serait pratique ?
Si vous pouviez être prêt par, disons 6h30, je serai à l’hôtel pour venir vous chercher.",C’est très bien. Je t’attendrai.,"Wie nett von ihm. Ich werde mich freuen, zu gehen. Aber welche Uhrzeit wäre günstig?
Wenn Sie bis 6:30 Uhr fertig sein könnten, werde ich im Hotel sein, um Sie abzuholen.",Das ist in Ordnung. Ich warte auf dich.,"वह कितना अच्छा है. मुझे जाने में खुशी होगी। लेकिन कितना समय सुविधाजनक होगा?
यदि आप 6:30 बजे तक तैयार हो सकते हैं, तो मैं आपको लेने के लिए होटल में रहूंगा।",कोई बात नहीं। मैं तुम्हारा इंतजार करूँगा।,"彼はなんて素敵なのでしょう。私は喜んで行きます.しかし、何時に便利でしょうか?
たとえば6時30分までに準備ができたら、ホテルに迎えに行きます。",いいです。私はあなたを待っています.,"얼마나 좋은지 . 나는 기뻐할 것이다. 그러나 몇시에 편리할까요?
6시 30 분까지 준비 할 수 있다면 호텔에 데리러 갈게요.",좋아요. 기다리고 있을게요 .,"Как приятно с ним. Я буду рад поехать. Но какое время будет удобно?
Если вы можете быть готовы к 6:30 часам, я буду в отеле, чтобы забрать вас.",Хорошо. Я буду ждать тебя.,"Qué bueno de él. Estaré encantado de ir. Pero, ¿qué hora sería conveniente?
Si pudieras estar listo para, digamos a las 6:30 en punto, estaré en el hotel para recogerte.",Está bien. Te estaré esperando.,3.3
"الكاد. هل ستقوم بفحص أي أمتعة اليوم؟
نعم ، حقيبة واحدة. لدي أيضا حقيبة محمولة.",هل تحتفظ بهذه الحقيبة الصغيرة كأمتعة محمولة يا سيدي؟,"勉强算了。您今天要托运行李吗？
是的，一个手提箱。我还有一个随身携带的包。",先生，您要把这个小包作为随身行李吗？,"Barely . Will you be checking any luggage today ?
Yes , One suitcase . I also have a carry-on bag .","Are you keeping this small bag as carry-on luggage , sir ?","À peine. Allez-vous enregistrer des bagages aujourd’hui ?
Oui, une valise. J’ai aussi un bagage à main.","Gardez-vous ce petit sac comme bagage à main, monsieur ?","Kaum. Werden Sie heute Gepäck aufgeben?
Ja, ein Koffer. Ich habe auch eine Handgepäcktasche.","Bewahren Sie diese kleine Tasche als Handgepäck auf, Sir?","मुश्किल से। क्या आप आज किसी सामान की जांच करेंगे?
हाँ, एक सूटकेस. मेरे पास एक कैरी-ऑन बैग भी है।","क्या आप इस छोटे बैग को सामान के रूप में रख रहे हैं, सर?","辛うじて。今日は荷物を預けますか?
はい、1つのスーツケース。機内持ち込み手荷物も持っています。",この小さなバッグを機内持ち込み手荷物として保管していますか?,"겨우. 오늘 수하물을 확인하시겠습니까?
예, 여행 가방 1 개. 기내 반입 가방도 있습니다.",이 작은 가방을 기내 반입 수하물로 보관하고 있습니까?,"Едва. Будете ли вы проверять какой-либо багаж сегодня?
Да, один чемодан. У меня также есть ручная кладь.","Вы держите эту маленькую сумку в качестве ручной клади, сэр?","Apenas. ¿Revisará algún equipaje hoy?
Sí, una maleta. También tengo una bolsa de mano.","¿Está guardando esta pequeña bolsa como equipaje de mano, señor?",3.8
"أنا دو جوان ، في الغرفة 312.
فهمت. انتظر في الغرفة ، من فضلك.",هل يمكنني الحصول على اسمك ورقم الغرفة؟,"我叫杜娟，住在312房间。
我明白了。请在房间里等一下。",能告诉我您的姓名和房间号吗？,"I'm Du Juan , in Room 312 .
I see . Wait in the room , please .",Could I have your name and room number ?,"Je suis du juan, dans la chambre 312.
Je vois. Attendez dans la chambre, s’il vous plaît.",Pourrais-je avoir votre nom et votre numéro de chambre ?,"Ich bin Du Juan, in Zimmer 312.
Ich verstehe. Warten Sie bitte im Zimmer.",Könnte ich Ihren Namen und Ihre Zimmernummer haben?,"मैं कमरा 312 में डु जुआन हूँ।
अच्छा। कृपया, कमरे में प्रतीक्षा करें।",क्या मुझे आपका नाम और कमरा नंबर मिल सकता है?,"私は312号室のデュファンです。
なるほど。部屋でお待ちください。",お名前と部屋番号を教えてもらえますか?,"저는 312호실에 있는 두후안입니다.
봐요. 방에서 기다려주세요.",당신의 이름과 방 번호를 알 수 있습니까?,"Меня зовут Дю Жуан, в комнате 312.
Ясно. Подождите в номере, пожалуйста.",Могу ли я назвать ваше имя и номер комнаты?,"Soy Du Juan, en la habitación 312.
Ya veo. Espera en la habitación, por favor.",¿Podría tener su nombre y número de habitación?,3.0
"ما هو شعورك حيال زواج المثليين؟
أعتقد أن لكل شخص الحق في حب من يريد .",هل تجعل زواج المثليين قانونيا؟,"你对同性婚姻有什么看法？
我认为每个人都有权利去爱他们想要的人。",你会让同性婚姻合法化吗？,"What do you feel about gay marriage ?
I think everyone has the right to love who they want .",Would you make gay marriage legal ?,"Que pensez-vous du mariage gay ?
Je pense que tout le monde a le droit d’aimer qui il veut.",Rendriez-vous légal le mariage gay ?,"Was denkst du über die Homo-Ehe?
Ich denke, jeder hat das Recht zu lieben, wen er will.",Würden Sie die Homo-Ehe legalisieren?,"समलैंगिक विवाह के बारे में आप क्या महसूस करते हैं?
मुझे लगता है कि हर किसी को प्यार करने का अधिकार है जिसे वे चाहते हैं।",क्या आप समलैंगिक विवाह को कानूनी बना देंगे?,"同性愛者の結婚についてどう思いますか?
私は誰もが彼らが望む人を愛する権利を持っていると思います.",同性愛者の結婚を合法化しますか?,"동성 결혼에 대해 어떻게 생각하세요?
나는 모든 사람이 자신이 원하는 사람을 사랑할 권리가 있다고 생각합니다.",동성 결혼을 합법화하시겠습니까?,"Что вы думаете об однополых браках?
Я думаю, что каждый имеет право любить того, кого он хочет.",Вы бы сделали однополые браки законными?,"¿Qué sientes sobre el matrimonio gay?
Creo que todo el mundo tiene derecho a amar a quien quiera.",¿Harías legal el matrimonio gay?,3.2
"النادل أعطى للتو المكالمة الأخيرة. دعنا نطلب جولة أخرى ، حسنا؟
بالتأكيد ، ولكن دعنا نحصل على إبريق هذه المرة يجب أن نكون قادرين على إسقاطه قبل إغلاقه.",النادل أعطى للتو المكالمة الأخيرة. دعنا نطلب جولة أخرى ، حسنا؟,"调酒师刚刚打了最后一声电话。我们再点一轮，好吗？
当然可以，但这次我们买个投手吧，我们应该能在他们关门前把球投下去。",调酒师刚刚打了最后一声电话。我们再点一轮，好吗？,"The bartender just gave the last call . Let's order another round , okay ?
Sure , but let's get a pitcher this time We should be able to down it before they close .","The bartender just gave the last call . Let's order another round , okay ?","Le barman vient de donner le dernier appel. Commandons un autre tour, d’accord ?
Bien sûr, mais prenons un pichet cette fois Nous devrions être en mesure de le descendre avant qu’ils ne ferment.","Le barman vient de donner le dernier appel. Commandons un autre tour, d’accord ?","Der Barkeeper hat gerade den letzten Anruf getätigt. Lass uns eine weitere Runde bestellen, okay?
Sicher, aber lassen Sie uns diesmal einen Krug bekommen, den wir in der Lage sein sollten, ihn herunterzufahren, bevor sie schließen.","Der Barkeeper hat gerade den letzten Anruf getätigt. Lass uns eine weitere Runde bestellen, okay?","बारटेंडर ने अभी आखिरी कॉल दिया। चलो एक और राउंड ऑर्डर करते हैं, ठीक है?
ज़रूर, लेकिन चलो इस बार एक घड़ा प्राप्त करते हैं, हमें बंद होने से पहले इसे नीचे करने में सक्षम होना चाहिए।","बारटेंडर ने अभी आखिरी कॉल दिया। चलो एक और राउंड ऑर्डर करते हैं, ठीक है?","バーテンダーはちょうど最後の電話をかけました.別のラウンドを注文しましょう、いいですか?
確かに、しかし今度はピッチャーを手に入れましょう彼らが閉じる前にそれをダウンさせることができるはずです。",バーテンダーはちょうど最後の電話をかけました.別のラウンドを注文しましょう、いいですか?,"바텐더가 방금 마지막 전화를했습니다. 다른 라운드를 주문하자, 알았지?
물론, 하지만 이번에는 투수를 구합시다 그들이 닫히기 전에 그것을 내릴 수 있어야 합니다.","바텐더가 방금 마지막 전화를했습니다. 다른 라운드를 주문하자, 알았지?","Бармен только что дал последний звонок. Давайте закажем еще один раунд, хорошо?
Конечно, но давайте получим кувшин на этот раз Мы должны быть в состоянии спустить его до того, как они закроются.","Бармен только что дал последний звонок. Давайте закажем еще один раунд, хорошо?","El camarero acaba de dar la última llamada. Ordenemos otra ronda, ¿de acuerdo?
Claro, pero vamos a conseguir un lanzador esta vez Deberíamos ser capaces de derribarlo antes de que cierren.","El camarero acaba de dar la última llamada. Ordenemos otra ronda, ¿de acuerdo?",2.6
"تشرفنا؟ يرجى الجلوس ، كيف هي رحلتك هنا؟
جيد جدا ، على ما أعتقد. جئت إلى هنا بالحافلة ، واستغرق الأمر حوالي 15 دقيقة.",نجاح باهر ، شكرا جزيلا .,"您好吗？请坐，您在这里的旅行怎么样？
我觉得挺好的。我坐公交车来的，花了大约15分钟。",哇，非常感谢。,"How do you do ? Please be seated , How is your trip here ?
Quite good , I think . I came here by bus , and it took me about 15 minutes .","Wow , thanks a lot .","Comment vas-tu? S’il vous plaît être assis, Comment est votre voyage ici ?
Assez bien, je pense. Je suis venu ici en bus, et cela m’a pris environ 15 minutes.","Wow, merci beaucoup.","Wie geht es dir? Bitte nehmen Sie Platz, wie ist Ihre Reise hier?
Ganz gut, denke ich. Ich kam mit dem Bus hierher und es dauerte ungefähr 15 Minuten.","Wow, vielen Dank.","आप कैसे हैं? कृपया बैठे रहें, आपकी यात्रा यहां कैसी है?
काफी अच्छा है, मुझे लगता है। मैं बस से यहां आया और मुझे लगभग 15 मिनट लगे .","वाह, बहुत बहुत धन्यवाद.","初めまして。着席してください、ここでの旅行はどうですか?
かなり良いと思います.バスで来て、15分くらいかかりました。",うわー、どうもありがとう.,"처음 뵙겠습니다? 앉으시기 바랍니다, 여기 여행은 어떻습니까?
꽤 좋은 것 같아요. 나는 버스로 여기에 왔고 약 15 분이 걸렸습니다.","와우, 정말 고마워요 .","Здравствуйте? Пожалуйста, сядьте, Как проходит ваша поездка сюда?
Неплохо, я думаю. Я приехал сюда на автобусе, и это заняло у меня около 15 минут.","Вау, спасибо большое.","¿Cómo estás? Por favor, siéntese, ¿Cómo es su viaje aquí?
Bastante bien, creo. Vine aquí en autobús, y me tomó unos 15 minutos.","Wow, muchas gracias.",3.3
"هل يبدأ الفصل مرة أخرى ، مام؟
نعم ، ولكن بالنسبة للصحة ، فإن هذا الاستراحة طويلة بما فيه الكفاية.",نعم ، أعني ذلك .,"这堂课又开始了吗，妈妈？
是的，但对于希斯来说，这次休息已经足够长了。",是的，我是认真的。,"Does the class start again , Mam ?
Yes , but to the heath , this break has long enough .","Yes , I mean it .","Est-ce que le cours recommence, Mam ?
Oui, mais à la lande, cette pause a assez de temps.","Oui, je le pense.","Geht der Unterricht wieder los, Mama?
Ja, aber zur Heide hat diese Pause lang genug.","Ja, ich meine es ernst.","क्या कक्षा फिर से शुरू होती है, माँ?
हां , लेकिन स्वास्थ्य के लिए यह ब्रेक काफी लंबा है .","हाँ, मेरा मतलब है।","クラスは再び始まりますか、ママ?
はい、しかしヒースにとって、この休憩は十分に長いです.",はい、私はそれを意味します.,"수업이 다시 시작되나요, 엄마?
예,하지만 히스에게이 휴식은 충분히 길다.","예, 의미합니다 .","Начинается ли класс снова, Mam ?
Да, но для здоровья, этот перерыв имеет достаточно долгий срок.","Да, я имею в виду.","¿La clase comienza de nuevo, Mam?
Sí, pero para la salud, este descanso ha sido suficiente.","Sí, lo digo en serio.",2.5
