arabic_ctx,arabic_res,chinese_ctx,chinese_res,english_ctx,english_res,french_ctx,french_res,german_ctx,german_res,hindi_ctx,hindi_res,japanese_ctx,japanese_res,korean_ctx,korean_res,russian_ctx,russian_res,spanish_ctx,spanish_res,ratings
"سآخذ القليل من الحليب ، لكن بدون سكر ، من فضلك. تأكد من ترك الشاي ينقع بضع دقائق قبل إخراج كيس الشاي من الكوب .
موافق. ما رأيك في غرفة المعيشة لدينا؟",لا يبدو الأمر كذلك . آسف يا سيدي ، لقد جربنا كل شيء ، لكننا غير قادرين على إزالته من القميص. كان من السكر على ما أعتقد.,"请给我一点牛奶，但不要加糖。在把茶包从杯子里拿出来之前，一定要让茶泡上几分钟。
好的。你觉得我们的起居室怎么样？",看起来不是这样的。对不起，先生，我们什么都试过了，但还是不能把它从衬衫上弄下来。我想是糖造成的。,"I'll take a little milk , but no sugar , please . Make sure you let the tea steep a few minutes before you take the tea bag out of the cup .
Ok . What do you think about our living room ?","It doesn't seem like that . Sorry , sir , we've tried everything , but we're not able to get it off the shirt . It was from the sugar I think .","Je vais prendre un peu de lait, mais pas de sucre, s’il vous plaît. Assurez-vous de laisser le thé infuser quelques minutes avant de sortir le sachet de thé de la tasse.
D’accord. Que pensez-vous de notre salon ?","Ça n’a pas l’air comme ça. Désolé, monsieur, nous avons tout essayé, mais nous ne sommes pas en mesure de l’enlever de la chemise. C’était du sucre je pense.","Ich nehme ein wenig Milch, aber keinen Zucker, bitte. Stellen Sie sicher, dass Sie den Tee ein paar Minuten ziehen lassen, bevor Sie den Teebeutel aus der Tasse nehmen.
Okay. Was denkst du über unser Wohnzimmer?","Es scheint nicht so. Tut mir leid, Sir, wir haben alles versucht, aber wir sind nicht in der Lage, es vom Hemd zu bekommen. Es war vom Zucker, glaube ich.","मैं थोड़ा दूध लूंगा, लेकिन कोई चीनी नहीं, कृपया। सुनिश्चित करें कि आप चाय बैग को कप से बाहर निकालने से कुछ मिनट पहले चाय को खड़ी होने दें।
ठीक है। आप हमारे लिविंग रूम के बारे में क्या सोचते हैं?","ऐसा नहीं लगता है। क्षमा करें, सर, हमने सब कुछ करने की कोशिश की है, लेकिन हम इसे शर्ट से उतारने में सक्षम नहीं हैं। यह चीनी से था जो मुझे लगता है।","牛乳を少し取りますが、砂糖は飲まないでください。ティーバッグをカップから取り出す前に、お茶を数分浸してください。
わかりました。私たちのリビングルームについてどう思いますか?",それはそのようには見えません.申し訳ありませんが、私たちはすべてを試しましたが、シャツから外すことができません.それは私が思う砂糖からでした.,"나는 약간의 우유를 가져갈 것이지만 설탕은 먹지 않을 것입니다. 컵에서 티백을 꺼내기 전에 차를 몇 분 동안 가파르게 두십시오.
그래. 우리 거실에 대해 어떻게 생각하세요?","그런 것 같지 않습니다 . 죄송합니다, 선생님, 우리는 모든 것을 시도했지만 셔츠에서 벗어날 수 없습니다. 그것은 내가 생각하는 설탕에서 나온 것입니다.","Я возьму немного молока, но без сахара, пожалуйста. Убедитесь, что вы дали чаю настояться за несколько минут, прежде чем вынуть чайный пакетик из чашки.
Хорошо. Что вы думаете о нашей гостиной?","Похоже, что это не так. Извините, сэр, мы перепробовали все, но мы не можем снять это с рубашки. Это было из сахара, я думаю.","Voy a tomar un poco de leche, pero sin azúcar, por favor. Asegúrese de dejar que el té se empape unos minutos antes de sacar la bolsa de té de la taza.
De acuerdo. ¿Qué opinas de nuestro salón?","No lo parece. Lo siento, señor, lo hemos intentado todo, pero no somos capaces de sacarlo de la camiseta. Fue del azúcar creo.",2.8
"أريد أن ألقي نظرة على ذلك المنزل مع أعلام البيت المفتوح في المقدمة.
يا له من حي رائع! هل يمكنك العثور على هذا المنزل في قائمة البيت المفتوح لدينا؟",نعم ، تبدو مثالية.,"我想看看前面挂着开放日旗帜的那栋房子。
多好的社区啊！你能在我们的开放参观名单上找到那栋房子吗？",是的，看起来很完美。,"I want to take a look at that home with the Open House flags out front .
What a wonderful neighborhood ! Can you find that house on our Open House list ?","Yes , it looks perfect .","Je veux jeter un coup d’œil à cette maison avec les drapeaux portes ouvertes à l’avant.
Quel quartier merveilleux ! Pouvez-vous trouver cette maison sur notre liste portes ouvertes ?","Oui, ça a l’air parfait.","Ich möchte einen Blick auf das Haus mit den Flaggen des offenen Hauses werfen.
Was für eine wundervolle Nachbarschaft! Können Sie dieses Haus auf unserer Liste der offenen Tür finden?","Ja, es sieht perfekt aus.","मैं उस घर पर एक नज़र डालना चाहता हूं जिसमें ओपन हाउस के झंडे सामने हैं।
क्या एक अद्भुत पड़ोस! क्या आप उस घर को हमारी ओपन हाउस सूची में पा सकते हैं?","हाँ, यह एकदम सही लग रहा है.","オープンハウスの旗を前にしてその家を見たいです。
なんて素晴らしい近所でしょう。オープンハウスリストでその家を見つけることができますか?",はい、それは完璧に見えます.,"오픈 하우스 깃발이 앞에 있는 그 집을 살펴보고 싶습니다.
정말 멋진 동네입니다! 오픈 하우스 목록에서 그 집을 찾을 수 있습니까?","예, 완벽 해 보입니다.","Я хочу взглянуть на этот дом с флагами Дня открытых дверей впереди.
Какой замечательный район! Можете ли вы найти этот дом в нашем списке Open House?","Да, выглядит идеально.","Quiero echar un vistazo a esa casa con las banderas de Open House al frente.
¡Qué barrio tan maravilloso! ¿Puedes encontrar esa casa en nuestra lista de Open House?","Sí, se ve perfecto.",4.0
"هوّن عليك. سيكون لدينا طفلنا . يجب أن تكون سعيدا .
نعم أعرف.",أعلم يا أمي .,"别着急。我们要有自己的孩子了。你应该高兴才对。
是啊，我知道。",我知道，妈妈。,"Take it easy . We are going to have our own baby . You should be happy .
Yeah , I know .","I know , mom .","Calme-toi. Nous allons avoir notre propre bébé. Vous devriez être heureux.
Oui je sais.","Je sais, maman.","Machen Sie es gut. Wir werden unser eigenes Baby bekommen. Sie sollten glücklich sein.
Ja ich weiß.","Ich weiß, Mama.","आराम से। हम अपना बच्चा पैदा करने जा रहे हैं। आपको खुश होना चाहिए।
हाँ मुझे मालूम है।","मुझे पता है, माँ।","気楽に。私たちは自分の赤ちゃんを産むつもりです。あなたは幸せになるはずです.
はい、知っています。",私は知っています、お母さん.,"진정하다. 우리는 우리 자신의 아기를 가질 것입니다 . 당신은 행복해야합니다 .
예, 알아요.","알아요, 엄마 .","Успокоиться и расслабиться. У нас будет собственный ребенок. Вы должны быть счастливы.
Знаю.","Я знаю, мама.","Calma. Vamos a tener nuestro propio bebé. Deberías ser feliz.
Lo sé.","Lo sé, mamá.",2.3
"ياه! خطك جميل جدا . كان يستحق الانتظار!
شكرًا لك. اليوم أكتب نوعا من القصيدة يسمى زوجا صينيا .",أوه ، إنها تستمر في قول ذلك. إنها لا تسمح لي أبدا بالحصول عليها .,"哇哦！你的书法很漂亮。等待是值得的！
谢谢你。今天我要写一首诗，叫中国对联。",哦，她一直这么说。她从来不允许我拥有它们。,"Wow ! Your calligraphy is very beautiful . It was worth the wait !
Thank you . Today I'm writing a kind of poem called a Chinese couplet .","oh , she keeps saying that . She never allows me to have them .","Pleurage! Votre calligraphie est très belle. Cela valait la peine d’attendre !
Merci. Aujourd’hui, j’écris une sorte de poème appelé un couplet chinois.","Oh, elle n’arrête pas de dire ça. Elle ne me permet jamais de les avoir.","Beeindruckend! Ihre Kalligraphie ist sehr schön. Das Warten hat sich gelohnt!
Vielen Dank. Heute schreibe ich eine Art Gedicht namens Chinese Couplet.","Oh, das sagt sie immer wieder. Sie erlaubt mir niemals, sie zu haben.","वाह! आपकी सुलेख बहुत सुंदर है। यह इंतजार के लायक था!
धन्यवाद। आज मैं एक तरह की कविता लिख रहा हूं जिसे चीनी दोहा कहा जाता है।","ओह, वह ऐसा कहती रहती है। वह मुझे कभी भी उन्हें लेने की अनुमति नहीं देता है।","ワウ！あなたの書道はとても美しいです。待った甲斐がありました!
ありがとうございました。今日、私は中国の対句と呼ばれる一種の詩を書いています.",ああ、彼女はそれを言い続けます.彼女は私がそれらを持つことを決して許しません.,"와우! 당신의 서예는 매우 아름답습니다 . 기다릴만한 가치가있었습니다!
감사합니다. 오늘 저는 중국 대련이라는 일종의 시를 쓰고 있습니다.","오, 그녀는 계속 그렇게 말합니다 . 그녀는 내가 그들을 갖는 것을 결코 허용하지 않습니다 .","Ой! Ваша каллиграфия очень красива. Это стоило ожидания!
Спасибо. Сегодня я пишу своеобразное стихотворение под названием «Китайский куплет».","О, она продолжает говорить, что . Она никогда не позволяет мне иметь их.","¡Uau! Tu caligrafía es muy bonita. ¡Valió la pena la espera!
Gracias. Hoy estoy escribiendo una especie de poema llamado copla china.","oh, ella sigue diciendo eso. Ella nunca me permite tenerlos.",2.2
"أي شيء خاطئ في ذلك؟
نعم. عندما قمت بنشرها في المنزل ، وجدت هذه الحفرة.",أنت بخير. دعنا نطلب منها أن تعطينا أسبوعا آخر .,"有什么问题吗？
是的。当我把它铺开回家的时候，我发现了这个洞。",你说得对。让我们请求她再给我们一周的时间。,"Anything wrong with it ?
Yes . When I spread it out back home , I found this hole .",You're right . Let's ask her to give us one more week .,"Quelque chose ne va pas ?
Oui. Quand je l’ai étalé à la maison, j’ai trouvé ce trou.",Tu as raison. Demandons-lui de nous donner une semaine de plus.,"Stimmt etwas nicht damit?
Ja. Als ich es zu Hause ausbreitete, fand ich dieses Loch.","Du hast Recht. Bitten wir sie, uns noch eine Woche Zeit zu geben.","इसके साथ कुछ गलत है?
हाँ। जब मैंने इसे घर वापस फैलाया, तो मुझे यह छेद मिला।",तुम सही हो। चलो उसे एक और सप्ताह देने के लिए कहते हैं।,"何か問題がありますか?
はい。家に帰って広げると、この穴を見つけました。",その通りです。彼女にもう一週間与えるように頼みましょう.,"뭐가 잘못 됐어?
예. 내가 그것을 집으로 펼쳤을 때, 나는이 구멍을 발견했다.",당신이 맞아요. 그녀에게 일주일 더 달라고 부탁합시다 .,"Что-то не так с ним?
Да. Когда я разложил его дома, я нашел это отверстие.",Ты прав. Давайте попросим ее дать нам еще одну неделю.,"¿Algo malo con eso?
Sí. Cuando lo extendí de vuelta a casa, encontré este agujero.",Tienes razón. Pidámosle que nos dé una semana más.,2.7
"الخدمة لم تساعد الوضع .
هل هذا مطعم تريد العودة إليه؟",صعدت إلى هناك في وقت مبكر من هذا الصباح.,"这项服务对这种情况没有帮助。
这是一家你想再来的餐厅吗？",我今天一大早就上去了。,"The service did not help the situation .
Is this a restaurant that you want to come back to ?",I went up there early this morning .,"Le service n’a pas aidé la situation.
Est-ce un restaurant où vous voulez revenir ?",J’y suis allé tôt ce matin.,"Der Service hat der Situation nicht geholfen.
Ist dies ein Restaurant, in das Sie zurückkehren möchten?",Ich bin heute früh dort hinaufgegangen.,"सेवा ने स्थिति में मदद नहीं की।
क्या यह एक रेस्तरां है जिसे आप वापस आना चाहते हैं?",मैं आज सुबह जल्दी वहां गया था।,"サービスは状況を助けませんでした.
これはあなたが戻ってきたいレストランですか?",私は今朝早くそこに上がりました。,"이 서비스는 상황을 돕지 않았습니다 .
이것은 당신이 다시오고 싶은 레스토랑입니까?",나는 오늘 아침 일찍 거기에 갔다.,"Сервис не помог ситуации.
Это ресторан, в который вы хотите вернуться?",Я поднялся туда рано утром.,"El servicio no ayudó a la situación.
¿Es este un restaurante al que quieres volver?",Subí allí temprano esta mañana.,2.2
"حسنا ، سيكون هناك أداء خيري ليلة السبت. وأيضا ، سيكون هناك حفل منفرد لنجم الأوبرا ليلة الأحد.
إنه لأمر جيد أن لدي خيارات هنا . هل يمكن أن تخبرني عن واحد يوم السبت؟",بالتأكيد ، يتم تهجئتها Office ثم D - E - P - O - T. انها 'ق في الصفحات الصفراء.,"嗯，星期六晚上会有慈善演出。此外，周日晚上将有一位歌剧明星的个人演唱会。
我在这里有选择，这是件好事。你能给我讲讲周六的那个吗？",当然，拼写是Office，然后是D-E-P-O-T。它在黄页上。,"Well , there will be charity performance on Saturday night . And also , there will be a solo concert by an opera star on Sunday night .
It's a good thing that I have choices here . Can you tell me about the one on Saturday ?","Sure , it's spelled Office and then D - E - P - O - T . It ' s in the Yellow Pages .","Eh bien, il y aura un spectacle de charité samedi soir. Et aussi, il y aura un concert solo d’une star de l’opéra dimanche soir.
C’est une bonne chose que j’ai des choix ici. Pouvez-vous me parler de celui de samedi ?","Bien sûr, il est orthographié Office, puis D - E - P - O - T . C’est dans les Pages Jaunes.","Nun, es wird am Samstagabend eine Wohltätigkeitsveranstaltung geben. Außerdem wird es am Sonntagabend ein Solokonzert eines Opernstars geben.
Es ist eine gute Sache, dass ich hier die Wahl habe. Können Sie mir etwas über den am Samstag erzählen?","Sicher, es wird Office geschrieben und dann D - E - P - O - T . Es ist in den Gelben Seiten.","खैर, शनिवार की रात दान-पुण्य का प्रदर्शन होगा। और साथ ही , रविवार रात को एक ओपेरा स्टार द्वारा एकल संगीत कार्यक्रम भी होगा .
यह अच्छी बात है कि मेरे पास यहां विकल्प हैं। क्या आप मुझे शनिवार को एक के बारे में बता सकते हैं?","निश्चित रूप से, यह कार्यालय लिखा गया है और फिर डी - ई - पी - ओ - टी। यह पीले पन्नों में है।","さて、土曜日の夜にチャリティーパフォーマンスがあります。また、日曜日の夜にはオペラスターによるソロコンサートがあります。
ここで選択肢があるのは良いことです。土曜日のものについて教えてください。",確かに、それはオフィスと綴られ、次にD - E - P - O - T と綴られています。それはイエローページにあります。,"글쎄, 토요일 밤에 자선 공연이있을 것입니다. 또한 일요일 밤에는 오페라 스타의 단독 콘서트가있을 것입니다.
여기에 선택권이 있다는 것은 좋은 일입니다. 토요일에 한 번 말씀해 주시겠습니까?","물론, 그것은 철자 사무실과 D - E - P - O - T . 그것은 ' 옐로우 페이지에 있습니다.","Что ж, в субботу вечером состоится благотворительное представление. А также, в воскресенье вечером состоится сольный концерт оперной звезды.
Хорошо, что у меня есть выбор здесь. Можете ли вы рассказать мне об одном в субботу?","Конечно, это пишется Office, а затем D - E - P - O - T. Это в Желтых страницах.","Bueno, habrá una actuación benéfica el sábado por la noche. Y también, habrá un concierto en solitario de una estrella de la ópera el domingo por la noche.
Es bueno que tenga opciones aquí. ¿Puede hablarme de la del sábado?","Claro, se escribe Office y luego D - E - P - O - T . Está en las Páginas Amarillas.",2.8
"ما رأيك في المعدات في شركتنا؟
علينا أن نجهز شركتنا بشبكة من محطات العمل في كل مكتب وغرفة عرض في أقرب وقت ممكن.",كيف تضمن الجودة؟,"你觉得我们公司的设备怎么样？
我们必须尽快在每个办公室和展厅为我们的公司配备一个工作站网络。",你们是如何保证质量的？,"What do you think about the equipment in our company ?
We have to equip our company with a network of work stations at every office and show room as soon as possible .",How do you ensure quality ?,"Que pensez-vous de l’équipement de notre entreprise ?
Nous devons équiper notre entreprise d’un réseau de postes de travail dans chaque bureau et salle d’exposition dès que possible.",Comment garantissez-vous la qualité ?,"Was denken Sie über die Ausrüstung in unserem Unternehmen?
Wir müssen unser Unternehmen so schnell wie möglich mit einem Netzwerk von Arbeitsplätzen in jedem Büro und Ausstellungsraum ausstatten.",Wie stellen Sie die Qualität sicher?,"आप हमारी कंपनी में उपकरण के बारे में क्या सोचते हैं?
हमें अपनी कंपनी को जल्द से जल्द हर कार्यालय और शो रूम में वर्क स्टेशनों के नेटवर्क से लैस करना होगा।",आप गुणवत्ता कैसे सुनिश्चित करते हैं?,"当社の設備についてどう思いますか?
私たちは、できるだけ早くすべてのオフィスとショールームにワークステーションのネットワークを会社に装備する必要があります。",どのように品質を確保しますか?,"우리 회사의 장비에 대해 어떻게 생각하십니까?
우리는 가능한 한 빨리 모든 사무실과 쇼룸에 워크 스테이션 네트워크를 회사에 갖추어야합니다.",품질을 어떻게 보장합니까?,"Что Вы думаете об оборудовании в нашей компании?
Мы должны как можно скорее оснастить нашу компанию сетью рабочих мест в каждом офисе и шоу-руме.",Как вы обеспечиваете качество?,"¿Qué opinas sobre los equipos en nuestra empresa?
Tenemos que equipar a nuestra empresa con una red de estaciones de trabajo en cada oficina y sala de exposición lo antes posible.",¿Cómo se garantiza la calidad?,3.9
"صرخت مرة أخرى بالطبع .
امسكها يا مايك . لن تنجز أي شيء بالصراخ في وجهه ، أليس كذلك؟ لقد عملت كل شيء حتى الآن. لماذا لا تنتظر حتى تبرد قليلا؟",حسنا ، أتمنى أن يتحدث معي شخص ما عن آداب المائدة الغربية,"当然，我也大声喊了回去。
等一下，迈克。你对他大喊大叫是不会有什么成就的，对吧？到现在为止，你一直都在努力。为什么不等你凉快一点再说呢？",嗯，我希望有人能跟我谈谈西方的餐桌礼仪,"I shouted it back of course .
Hold it , Mike . You won't accomplish anything by hollering at him , right ? You worked it all up till now . Why not wait until you cool down a bit ?","well , I wish someone could talk to me about Western table manners","Je l’ai crié en retour bien sûr.
Tenez-le, Mike. Vous n’accomplirez rien en hurlant sur lui, n’est-ce pas ? Vous avez tout travaillé jusqu’à présent. Pourquoi ne pas attendre de vous calmer un peu ?","eh bien, j’aimerais que quelqu’un puisse me parler des manières de table occidentales","Ich schrie es natürlich zurück.
Halt ihn fest, Mike. Du wirst nichts erreichen, wenn du ihn anbrüllst, oder? Sie haben alles bis jetzt bearbeitet. Warum nicht warten, bis Sie sich etwas abgekühlt haben?","nun, ich wünschte, jemand könnte mit mir über westliche Tischmanieren sprechen","मैंने इसे वापस चिल्लाया।
इसे पकड़ो, माइक। आप उस पर चिल्लाकर कुछ भी हासिल नहीं करेंगे, है ना? आपने अब तक यह सब काम किया है। जब तक आप थोड़ा ठंडा नहीं हो जाते तब तक इंतजार क्यों न करें?","खैर, मैं चाहता हूं कि कोई मुझसे पश्चिमी टेबल शिष्टाचार के बारे में बात कर सके","もちろん叫び返しました.
それを持って、マイク.あなたは彼に叫ぶことによって何も成し遂げませんよね?あなたは今までそれをすべて働きました.少し冷めるまで待ってみませんか?",まあ、誰かが西洋のテーブルマナーについて私に話してくれるならいいのにと思います,"나는 물론 그것을 외쳤다.
잡아, 마이크 . 당신은 그에게 환호하는 것으로 아무것도 성취하지 못할 것입니다. 당신은 지금까지 모든 것을 일했습니다. 조금 식을 때까지 기다리지 않겠습니까?","글쎄, 나는 누군가가 서양 테이블 매너에 대해 나에게 이야기 할 수 있기를 바란다.","Я, конечно, выкрикнул это в ответ.
Держи его, Майк. Вы ничего не добьетесь, крича на него, верно? Вы работали над всем этим до сих пор. Почему бы не подождать, пока вы немного остынете?","Ну, я хотел бы, чтобы кто-нибудь мог поговорить со мной о западных манерах за столом","Lo grité de vuelta, por supuesto.
Sostenlo, Mike. No lograrás nada gritándole, ¿verdad? Lo trabajaste todo hasta ahora. ¿Por qué no esperar hasta que te enfríes un poco?","bueno, ojalá alguien pudiera hablarme sobre los modales de mesa occidentales",2.7
