arabic_ctx,arabic_res,chinese_ctx,chinese_res,english_ctx,english_res,french_ctx,french_res,german_ctx,german_res,hindi_ctx,hindi_res,japanese_ctx,japanese_res,korean_ctx,korean_res,russian_ctx,russian_res,spanish_ctx,spanish_res,ratings
"إنه معرض لليشم الصيني. يقام كل عام . مجموعة لطيفة من اليشم معروضة وتباع.
يبدو رائعا! هل يمكنك التوقف في مكان ما هنا لمدة دقيقة؟ سأحصل على بعض الهدايا التذكارية لأصدقائي.",أوه ، أنا آسف حقا . لقد كنت أتطلع إلى رؤيتك .,"这是一场中国玉器展览。它每年举行一次。一批精美的玉器正在展出和出售。
听起来很棒！你能在这里的某个地方停一下吗？我要给我的朋友们买些纪念品。",哦，我真的很抱歉。我一直盼望着见到你。,"It is an exhibition of Chinese jades . It is held each year . A nice collection jades of are on display and sold .
Sounds great ! Can you stop somewhere here for a minute ? I will get some souvenirs for my friends .","Oh , I am really sorry . I have been looking forward to seeing you .","Il s’agit d’une exposition de jades chinois. Il a lieu chaque année. Une belle collection de jades de sont exposés et vendus.
Ça sonne bien ! Pouvez-vous vous arrêter quelque part ici pendant une minute ? Je vais chercher des souvenirs pour mes amis.","Oh, je suis vraiment désolé . J’ai hâte de vous voir.","Es ist eine Ausstellung chinesischer Jade. Es findet jedes Jahr statt. Eine schöne Sammlung von Jaden sind ausgestellt und verkauft.
Hört sich gut an! Können Sie hier irgendwo für eine Minute anhalten? Ich werde ein paar Souvenirs für meine Freunde besorgen.","Oh, es tut mir wirklich leid. Ich habe mich auf Sie gefreut.","यह चीनी जेडों की प्रदर्शनी है। यह हर साल आयोजित किया जाता है। एक अच्छा संग्रह जेड प्रदर्शन पर हैं और बेचे जाते हैं।
बहुत अच्छा लगता है! क्या आप यहां एक मिनट के लिए रुक सकते हैं? मुझे अपने दोस्तों के लिए कुछ स्मृति चिन्ह मिलेंगे।","ओह, मुझे वास्तव में खेद है। मैं आपसे मिलने के लिए उत्सुक था।","中国の翡翠の展示です。毎年開催されています。素敵なコレクションの翡翠が展示され、販売されています。
いいですね！ちょっとここのどこかに立ち寄ってくれませんか?友達にお土産をもらいます。",ああ、本当にごめんなさい.お会いできるのを楽しみにしていました。,"중국 옥 전시회입니다. 매년 개최됩니다. 멋진 컬렉션 옥이 전시되어 판매됩니다.
멋지네요! 여기 어딘가에서 잠깐 멈출 수 있습니까? 나는 친구들을위한 기념품을 얻을 것이다.","아, 정말 죄송합니다 . 나는 당신을 만나기를 고대하고 있습니다 .","Это выставка китайского нефрита. Он проводится каждый год. Хорошая коллекция нефритов выставлена на обозрение и продается.
Звучит здорово! Можете ли вы остановиться где-нибудь здесь на минуту? Я получу несколько сувениров для моих друзей.","О, мне очень жаль. Я с нетерпением ждал встречи с вами.","Se trata de una exposición de jades chinos. Se celebra cada año. Una bonita colección de jades de están en exhibición y se venden.
¡Excelente! ¿Puedes parar en algún lugar aquí por un minuto? Conseguiré algunos recuerdos para mis amigos.","Oh, lo siento mucho. He estado deseando verte.",2.8
"هل سبق لك أن حاولت التسوق عبر الإنترنت؟
لا ، أبدا . أفضل أن أرى وألمس ما أشتريه قبل أن أدفع ثمنه ، خاصة بالنسبة للملابس والأحذية.",ماذا عن الحجم؟,"你试过网上购物吗？
不，永远不会。我更喜欢在付钱之前亲眼看到和触摸我要买的东西，特别是衣服和鞋子。",尺码怎么样？,"Have you ever tried shopping online ?
No , never . I prefer to actually see and touch what I'm buying before I pay for it , especially for clothes and shoes .",What about the size ?,"Avez-vous déjà essayé de magasiner en ligne ?
Non, jamais. Je préfère réellement voir et toucher ce que j’achète avant de le payer, en particulier pour les vêtements et les chaussures.",Qu’en est-il de la taille ?,"Haben Sie schon einmal versucht, online einzukaufen?
Nein, niemals. Ich ziehe es vor, das, was ich kaufe, tatsächlich zu sehen und zu berühren, bevor ich dafür bezahle, besonders für Kleidung und Schuhe.",Wie sieht es mit der Größe aus?,"क्या आपने कभी ऑनलाइन खरीदारी करने की कोशिश की है?
नहीं, कभी नहीं। मैं वास्तव में देखना और छूना पसंद करता हूं कि मैं इसके लिए भुगतान करने से पहले क्या खरीद रहा हूं, खासकर कपड़े और जूते के लिए।",आकार के बारे में क्या?,"オンラインショッピングを試したことがありますか?
いいえ、決して.私はそれを支払う前に、特に服や靴のために、私が買っているものを実際に見て触れることを好みます。",サイズはどうですか?,"온라인 쇼핑을 해본 적이 있습니까?
아니, 절대 . 나는 특히 옷과 신발을 지불하기 전에 내가 사는 것을 실제로보고 만지는 것을 선호합니다.",크기는 어떨까요?,"Вы когда-нибудь пробовали делать покупки в Интернете?
Нет, никогда. Я предпочитаю на самом деле видеть и трогать то, что я покупаю, прежде чем платить за это, особенно за одежду и обувь.",А как насчет размера?,"¿Alguna vez has intentado comprar en línea?
No, nunca. Prefiero ver y tocar lo que estoy comprando antes de pagarlo, especialmente para la ropa y los zapatos.",¿Qué pasa con el tamaño?,3.5
"كم هو لطيف منه . سأكون سعيدا للذهاب . ولكن ما الوقت سيكون مناسبا؟
إذا كنت يمكن أن تكون جاهزا بحلول الساعة 6:30 ، سأكون في الفندق لاصطحابك.",هذا ' ق على ما يرام .,"他真是个好人。我很乐意去。但是什么时候方便呢？
如果你能在6：30之前准备好，我会在旅馆接你。",那很好。,"How nice of him . I'll be delighted to go . But what time would be convenient ?
If you could be ready by , say 6:30 o'clock , I'll be at the hotel to pick you up .",That ' s fine .,"Comme c’est gentil de sa part. Je serai ravi d’y aller. Mais quelle heure serait pratique ?
Si vous pouviez être prêt par, disons 6h30, je serai à l’hôtel pour venir vous chercher.",C’est très bien.,"Wie nett von ihm. Ich werde mich freuen, zu gehen. Aber welche Uhrzeit wäre günstig?
Wenn Sie bis 6:30 Uhr fertig sein könnten, werde ich im Hotel sein, um Sie abzuholen.",Das ist in Ordnung.,"वह कितना अच्छा है. मुझे जाने में खुशी होगी। लेकिन कितना समय सुविधाजनक होगा?
यदि आप 6:30 बजे तक तैयार हो सकते हैं, तो मैं आपको लेने के लिए होटल में रहूंगा।",यह ठीक है।,"彼はなんて素敵なのでしょう。私は喜んで行きます.しかし、何時に便利でしょうか?
たとえば6時30分までに準備ができたら、ホテルに迎えに行きます。",それは大丈夫です.,"얼마나 좋은지 . 나는 기뻐할 것이다. 그러나 몇시에 편리할까요?
6시 30 분까지 준비 할 수 있다면 호텔에 데리러 갈게요.",괜찮아요 .,"Как приятно с ним. Я буду рад поехать. Но какое время будет удобно?
Если вы можете быть готовы к 6:30 часам, я буду в отеле, чтобы забрать вас.",Это нормально.,"Qué bueno de él. Estaré encantado de ir. Pero, ¿qué hora sería conveniente?
Si pudieras estar listo para, digamos a las 6:30 en punto, estaré en el hotel para recogerte.",Eso está bien.,3.5
"الكاد. هل ستقوم بفحص أي أمتعة اليوم؟
نعم ، حقيبة واحدة. لدي أيضا حقيبة محمولة.",هل لديك أي شيء لتعلنه؟,"勉强算了。您今天要托运行李吗？
是的，一个手提箱。我还有一个随身携带的包。",您有什么要申报的吗？,"Barely . Will you be checking any luggage today ?
Yes , One suitcase . I also have a carry-on bag .",Do you have anything to declare ?,"À peine. Allez-vous enregistrer des bagages aujourd’hui ?
Oui, une valise. J’ai aussi un bagage à main.",Avez-vous quelque chose à déclarer ?,"Kaum. Werden Sie heute Gepäck aufgeben?
Ja, ein Koffer. Ich habe auch eine Handgepäcktasche.",Haben Sie etwas zu deklarieren?,"मुश्किल से। क्या आप आज किसी सामान की जांच करेंगे?
हाँ, एक सूटकेस. मेरे पास एक कैरी-ऑन बैग भी है।",क्या आपके पास घोषित करने के लिए कुछ है?,"辛うじて。今日は荷物を預けますか?
はい、1つのスーツケース。機内持ち込み手荷物も持っています。",宣言するものはありますか?,"겨우. 오늘 수하물을 확인하시겠습니까?
예, 여행 가방 1 개. 기내 반입 가방도 있습니다.",선언 할 것이 있습니까?,"Едва. Будете ли вы проверять какой-либо багаж сегодня?
Да, один чемодан. У меня также есть ручная кладь.",Вам есть что декларировать?,"Apenas. ¿Revisará algún equipaje hoy?
Sí, una maleta. También tengo una bolsa de mano.",¿Tienes algo que declarar?,3.0
"أنا دو جوان ، في الغرفة 312.
فهمت. انتظر في الغرفة ، من فضلك.",موافق.,"我叫杜娟，住在312房间。
我明白了。请在房间里等一下。",好的。,"I'm Du Juan , in Room 312 .
I see . Wait in the room , please .",OK .,"Je suis du juan, dans la chambre 312.
Je vois. Attendez dans la chambre, s’il vous plaît.",D’ACCORD.,"Ich bin Du Juan, in Zimmer 312.
Ich verstehe. Warten Sie bitte im Zimmer.",OKAY.,"मैं कमरा 312 में डु जुआन हूँ।
अच्छा। कृपया, कमरे में प्रतीक्षा करें।",ठीक है।,"私は312号室のデュファンです。
なるほど。部屋でお待ちください。",わかりました。,"저는 312호실에 있는 두후안입니다.
봐요. 방에서 기다려주세요.",그래.,"Меня зовут Дю Жуан, в комнате 312.
Ясно. Подождите в номере, пожалуйста.",ХОРОШО.,"Soy Du Juan, en la habitación 312.
Ya veo. Espera en la habitación, por favor.",DE ACUERDO.,3.6
"ما هو شعورك حيال زواج المثليين؟
أعتقد أن لكل شخص الحق في حب من يريد .",انهم ' شعبية حقا.,"你对同性婚姻有什么看法？
我认为每个人都有权利去爱他们想要的人。",它们真的很受欢迎。,"What do you feel about gay marriage ?
I think everyone has the right to love who they want .",They ' re really popular .,"Que pensez-vous du mariage gay ?
Je pense que tout le monde a le droit d’aimer qui il veut.",Ils sont vraiment populaires.,"Was denkst du über die Homo-Ehe?
Ich denke, jeder hat das Recht zu lieben, wen er will.",Sie sind sehr beliebt.,"समलैंगिक विवाह के बारे में आप क्या महसूस करते हैं?
मुझे लगता है कि हर किसी को प्यार करने का अधिकार है जिसे वे चाहते हैं।",वे वास्तव में लोकप्रिय हैं .,"同性愛者の結婚についてどう思いますか?
私は誰もが彼らが望む人を愛する権利を持っていると思います.",彼らは本当に人気があります。,"동성 결혼에 대해 어떻게 생각하세요?
나는 모든 사람이 자신이 원하는 사람을 사랑할 권리가 있다고 생각합니다.",그들은 정말 인기가 있습니다.,"Что вы думаете об однополых браках?
Я думаю, что каждый имеет право любить того, кого он хочет.",Они действительно популярны.,"¿Qué sientes sobre el matrimonio gay?
Creo que todo el mundo tiene derecho a amar a quien quiera.",Son muy populares.,2.4
"النادل أعطى للتو المكالمة الأخيرة. دعنا نطلب جولة أخرى ، حسنا؟
بالتأكيد ، ولكن دعنا نحصل على إبريق هذه المرة يجب أن نكون قادرين على إسقاطه قبل إغلاقه.",هذا جيد . سأكون هناك .,"调酒师刚刚打了最后一声电话。我们再点一轮，好吗？
当然可以，但这次我们买个投手吧，我们应该能在他们关门前把球投下去。",那很好。我会去的。,"The bartender just gave the last call . Let's order another round , okay ?
Sure , but let's get a pitcher this time We should be able to down it before they close .",That ' s good . I ' ll be there .,"Le barman vient de donner le dernier appel. Commandons un autre tour, d’accord ?
Bien sûr, mais prenons un pichet cette fois Nous devrions être en mesure de le descendre avant qu’ils ne ferment.",C’est bien. Je serai là.,"Der Barkeeper hat gerade den letzten Anruf getätigt. Lass uns eine weitere Runde bestellen, okay?
Sicher, aber lassen Sie uns diesmal einen Krug bekommen, den wir in der Lage sein sollten, ihn herunterzufahren, bevor sie schließen.",Das ist gut. Ich werde da sein.,"बारटेंडर ने अभी आखिरी कॉल दिया। चलो एक और राउंड ऑर्डर करते हैं, ठीक है?
ज़रूर, लेकिन चलो इस बार एक घड़ा प्राप्त करते हैं, हमें बंद होने से पहले इसे नीचे करने में सक्षम होना चाहिए।",यह अच्छा है। मैं वहां रहूंगा।,"バーテンダーはちょうど最後の電話をかけました.別のラウンドを注文しましょう、いいですか?
確かに、しかし今度はピッチャーを手に入れましょう彼らが閉じる前にそれをダウンさせることができるはずです。",それは良いことです.私はそこにいます.,"바텐더가 방금 마지막 전화를했습니다. 다른 라운드를 주문하자, 알았지?
물론, 하지만 이번에는 투수를 구합시다 그들이 닫히기 전에 그것을 내릴 수 있어야 합니다.",그것은 ' 좋은 . 나는 거기있을거야.,"Бармен только что дал последний звонок. Давайте закажем еще один раунд, хорошо?
Конечно, но давайте получим кувшин на этот раз Мы должны быть в состоянии спустить его до того, как они закроются.",Это хорошо. Я буду там.,"El camarero acaba de dar la última llamada. Ordenemos otra ronda, ¿de acuerdo?
Claro, pero vamos a conseguir un lanzador esta vez Deberíamos ser capaces de derribarlo antes de que cierren.",Eso es bueno. Estaré allí.,4.0
"تشرفنا؟ يرجى الجلوس ، كيف هي رحلتك هنا؟
جيد جدا ، على ما أعتقد. جئت إلى هنا بالحافلة ، واستغرق الأمر حوالي 15 دقيقة.",حقا؟,"您好吗？请坐，您在这里的旅行怎么样？
我觉得挺好的。我坐公交车来的，花了大约15分钟。",真的吗？,"How do you do ? Please be seated , How is your trip here ?
Quite good , I think . I came here by bus , and it took me about 15 minutes .",Really ?,"Comment vas-tu? S’il vous plaît être assis, Comment est votre voyage ici ?
Assez bien, je pense. Je suis venu ici en bus, et cela m’a pris environ 15 minutes.",Vraiment?,"Wie geht es dir? Bitte nehmen Sie Platz, wie ist Ihre Reise hier?
Ganz gut, denke ich. Ich kam mit dem Bus hierher und es dauerte ungefähr 15 Minuten.",Wirklich?,"आप कैसे हैं? कृपया बैठे रहें, आपकी यात्रा यहां कैसी है?
काफी अच्छा है, मुझे लगता है। मैं बस से यहां आया और मुझे लगभग 15 मिनट लगे .",वाक़ई?,"初めまして。着席してください、ここでの旅行はどうですか?
かなり良いと思います.バスで来て、15分くらいかかりました。",ほんとですか。,"처음 뵙겠습니다? 앉으시기 바랍니다, 여기 여행은 어떻습니까?
꽤 좋은 것 같아요. 나는 버스로 여기에 왔고 약 15 분이 걸렸습니다.",정말로?,"Здравствуйте? Пожалуйста, сядьте, Как проходит ваша поездка сюда?
Неплохо, я думаю. Я приехал сюда на автобусе, и это заняло у меня около 15 минут.",Действительно?,"¿Cómo estás? Por favor, siéntese, ¿Cómo es su viaje aquí?
Bastante bien, creo. Vine aquí en autobús, y me tomó unos 15 minutos.",¿Realmente?,3.7
"هل يبدأ الفصل مرة أخرى ، مام؟
نعم ، ولكن بالنسبة للصحة ، فإن هذا الاستراحة طويلة بما فيه الكفاية.",نعم ، ولكن لدي الكثير من الوقت .,"这堂课又开始了吗，妈妈？
是的，但对于希斯来说，这次休息已经足够长了。",是的，但我有很多时间。,"Does the class start again , Mam ?
Yes , but to the heath , this break has long enough .","Yes , but I have a lot of time .","Est-ce que le cours recommence, Mam ?
Oui, mais à la lande, cette pause a assez de temps.","Oui, mais j’ai beaucoup de temps.","Geht der Unterricht wieder los, Mama?
Ja, aber zur Heide hat diese Pause lang genug.","Ja, aber ich habe viel Zeit.","क्या कक्षा फिर से शुरू होती है, माँ?
हां , लेकिन स्वास्थ्य के लिए यह ब्रेक काफी लंबा है .","हां, लेकिन मेरे पास बहुत समय है।","クラスは再び始まりますか、ママ?
はい、しかしヒースにとって、この休憩は十分に長いです.",はい、しかし私は多くの時間があります.,"수업이 다시 시작되나요, 엄마?
예,하지만 히스에게이 휴식은 충분히 길다.","예,하지만 시간이 많습니다 .","Начинается ли класс снова, Mam ?
Да, но для здоровья, этот перерыв имеет достаточно долгий срок.","Да, но у меня много времени.","¿La clase comienza de nuevo, Mam?
Sí, pero para la salud, este descanso ha sido suficiente.","Sí, pero tengo mucho tiempo.",3.3
"واثق! هل أنت بخير؟؟ يبدو أنك قلق بعض الشيء . ما الذي يدور في ذهنك؟
نحن نحتاج إلى التحدث.",أنا بحاجة للتحدث معك .,"当然可以！你还好吗？你看起来有点担心。你在想什么？
我们需要谈谈。",我需要和你谈谈。,"Sure ! Are you okay ? You seem a bit worried . What's on your mind ?
We need to talk .",I need to talk with you .,"Sûr! Vous allez bien? Vous semblez un peu inquiet. Qu’est-ce que tu penses ?
Il faut qu’on parle.",J’ai besoin de parler avec vous.,"Sicher! Bist du in Ordnung? Du scheinst ein bisschen besorgt zu sein. Woran denken Sie?
Wir müssen reden.",Ich muss mit dir reden.,"पक्का! आप ठीक तो हैं न? आप थोड़ा चिंतित लग रहे हैं। आपके दिमाग में क्या है?
हमें बात करने की जरूरत है।",मुझे आपसे बात करने की जरूरत है।,"もちろん！大丈夫ですか。あなたは少し心配しているようです.あなたの心には何がありますか?
話をする必要があります。",私はあなたと話す必要があります.,"물론! 괜찮으세요? 당신은 조금 걱정하는 것 같습니다 . 무슨 생각을 하고 계신가요?
우리는 말해야 해요.",나는 너와 이야기해야한다.,"Уверенный! Ты в порядке? Вы, кажется, немного обеспокоены. Что у вас на уме?
Нам надо поговорить.",Мне нужно поговорить с вами.,"¡Seguro! ¿Estás bien? Pareces un poco preocupado. ¿Qué tienes en mente?
Tenemos que hablar.",Necesito hablar contigo.,3.3
